ID,Version,Type,Question,A,B,C,D,E,A_type_cor,A_cor,B_cor,C_cor,D_cor,Year,Week,Chapter,State,Tags,Remarks,Selection
2024001,1,A,Welche Hauptstadt gehört zu Frankreich?,Paris,London,Rom,Madrid,Bern,A,TRUE,TRUE,TRUE,TRUE,2024,1,1,Creating,,,FALSE
2024006,1,K,Welche Stadt liegt in Frankreich?,Paris,Lille,Genf,Wien,,A,TRUE,TRUE,FALSE,FALSE,2024,1,1,Review,,,TRUE
2024007,1,K,Welche Länder liegen in Europa?,Schweiz,USA,China,Estland,,A,TRUE,FALSE,FALSE,TRUE,2024,2,2,Review,,,FALSE
2024003,1,A,Welches Tier ist ein Säugetier?,Krokodil,Hund,Falke,Karpfen,Huhn,B,TRUE,FALSE,FALSE,TRUE,2024,3,3,Review,,,TRUE
2024004,1,A,In welchem Kontinent liegt Ägypten?,Asien,Europa,Afrika,Australien,Arktis,C,TRUE,FALSE,FALSE,TRUE,2024,3,4,Creating,,,FALSE
2024002,1,A,Welche Farbe hat der Himmel bei klarem Wetter?,Blau,Grün,Rot,Gelb,Pink,A,TRUE,FALSE,FALSE,TRUE,2024,2,5,Creating,,,FALSE
2024005,1,A,Welches dieser Elemente ist ein Edelgas?,Sauerstoff,Stickstoff,Wasserstoff,Argon,Stickstoff,D,TRUE,FALSE,FALSE,TRUE,2024,4,5,Creating,,,FALSE
